risk_channel,dataset_used,indicator,observed_evidence,political_economic_interpretation,strength_of_evidence,limitation
Energy security,"crude_oil_flow_clean.csv, lng_flow_clean.csv","crude_flow_index, lng_flow_index (period means)","Crude flow fell -95% and LNG flow fell -99% from P0 to P2, with no recovery through P3 (Section 6).","Is consistent with a severe, sustained interruption to physical energy export capacity through the strait, which is the core energy-security concern chokepoint analyses (e.g. EIA) generally raise about Hormuz.","Strong (large, direct, sustained effect in the primary data)","The data shows that flow collapsed, not the operational cause (blockade vs. self-imposed rerouting vs. insurance withdrawal); no vessel-level cause data is available."
Maritime chokepoint risk,ship_arrivals_clean.csv,total_ship_arrivals and 5 vessel-category arrivals (period means),All five vessel categories fell between -83% and -100% from P0 to P2 (Section 7) -- not concentrated in tankers.,"Suggests a broad, chokepoint-wide disruption to shipping in general, not a disruption that selectively targeted energy tankers -- consistent with EIA-style chokepoint-vulnerability framing, which treats Hormuz risk as affecting all transiting traffic.","Moderate-to-strong (clear pattern across all 5 categories, but geography of the underlying data is unconfirmed)",arrivals-of-ships.csv has no port/geography metadata in the file itself; this notebook cannot independently confirm it is Hormuz-specific.
Oil market risk,brent_price_clean.csv,"brent_price, brent_return, brent_volatility_7d/14d (period means)",Brent's mean price rose 58% from P0 to P2 and daily-return volatility roughly tripled (Section 8).,Is consistent with markets pricing higher supply risk and geopolitical uncertainty during escalation and peak disruption.,Strong for escalation/peak; not assessable for the 2026-07-08 renewed-tension marker (Brent data ends 2026-06-29).,"Price data cannot separate a Hormuz-specific risk premium from simultaneous, unrelated global oil-market drivers."
Expectations / risk premium,integrated_hormuz_analysis_dataset.csv,"Normalized crude/LNG flow vs. normalized Brent price (Section 9, Figure 17)","Brent price partially eases from its P2 peak during P3, while crude and LNG flow show no recovery at all in the same window.","May indicate that Brent pricing reflects expectations about a return to normal operations and a geopolitical risk premium, rather than reacting only to current zero physical throughput -- but this is an interpretation, not a proven mechanism.","Partial / cautious -- the divergence pattern is real in the data, but the risk-premium explanation is one plausible reading among several.","Cannot isolate a risk premium from other simultaneous market drivers (global supply/demand, other geopolitical events, general market conditions) with these four datasets alone."
Regional and global vulnerability,All four datasets (empirical) + Reuters/AP/CNBC/EIA (context only),Qualitative synthesis of Sections 6-9,"Combination of a collapsed physical energy flow, a broadly disrupted shipping pattern, and an elevated/volatile Brent price during the crisis window.","The findings are consistent with -- without proving -- broader political-economic risk channels for energy-importing economies: energy security exposure, elevated shipping/insurance risk, potential inflationary pressure transmitted through oil prices, and supply-chain uncertainty for trade routed through or near the strait.","Interpretive framework, not directly tested","This channel draws on news context for framing; the notebook has no inflation, insurance-cost, or trade-volume data to test these downstream effects directly, and does not claim to."
